{
  "schemaVersion": 2,
  "id": "milli-demokratik-devlet-ve-kalkinma",
  "articleType": {"id": "perspective-piece", "tr": "Değerlendirme Makalesi", "en": "Perspective Piece", "peerReviewed": false},
  "title": {"en": "National-Democratic State and Development", "tr": "Milli Demokratik Devlet ve Kalkınma"},
  "authors": [{"displayName": "Prof. Dr. Semih Koray", "givenName": "Semih", "familyName": "Koray", "orcid": null, "affiliations": [{"name": "Bilkent University", "nameTr": "Bilkent Üniversitesi", "nameEn": "Bilkent University", "country": "Türkiye", "ror": null}]}],
  "abstract": {
    "en": "The biggest difference of the 21st century from the 20th century is that the “Oppressed World” has created from within itself a “Developing World” that tends to be an alternative to the imperialist system in all aspects of life. The center of production in the world has shifted from the West to the East. The successes of the People’s Republic of China, which led this process with a state-led and sharing approach, created a “miracle” effect all over the world. Today, the whole world is in search of a more egalitarian and fair international order. More importantly, the achievements of the Developing World and the multipolarity accompanying it create a suitable ground for each country to benefit from international cooperation in line with the development strategy it has determined for itself. Today, the decline of imperialist hegemony and the widening of the living space of developing countries cause the objective imperatives of these countries to play a more active role in guiding the attitudes of both their governments and their peoples. The objective conditions in the world today create a very suitable basis for Turkey to complete its national democratic revolution that it started with the Kemalist Revolution. The 20th century began with the rising wave of democratic revolutions in Russia, Turkey, China and Iran. It is no coincidence that these four countries are still at the forefront of the struggle against imperialist hegemony at the beginning of the 21st century. This is a clear indication that our age is the Age of National Democratic Revolutions and Opening up to Socialism.",
    "tr": "21. yüzyılın 20. yüzyıldan en büyük farkı, Ezilen Dünya’nın kendi içinden hayatın her alanında emperyalist sisteme seçenek olmaya yönelen bir Gelişen Dünya çıkarmış olmasıdır. Dünyada üretimin odağı Batı’dan Doğu’ya kaymıştır. Bu sürecin başını çeken Çin Halk Cumhuriyeti’nin devlet öncülüğünde kamucu ve paylaşımcı bir yaklaşımla kazandığı başarılar bütün dünyada bir “mucize” etkisi yaratmıştır. Bugün bütün dünya, daha eşitlikçi ve adil yeni bir uluslararası düzen arayışı içindedir. Daha da önemlisi, Gelişen Dünya’nın başarıları ve beraberinde getirdiği çok kutupluluk, her ülkenin kendisi için belirlediği kalkınma stratejisi doğrultusunda uluslararası işbirliğinden yararlanması için uygun bir zemin yaratmaktadır. Bugün emperyalist hegemonyanın geriletilmesinin gelişmekte olan ülkelerin hayat alanını genişletmesi, bu ülkelerin nesnel zorunluluklarının hem yönetimlerinin hem de halklarının tutumlarını yönlendirmede daha etkin bir rol oynamasına yol açmaktadır. Dünyadaki nesnel koşullar, Türkiye’nin Kemalist Devrim’le büyük bir atılım yaparak başlattığı milli demokratik devrimini tamamlaması için son derece uygun bir zemin yaratmaktadır. 20. yüzyıl, Rusya, Türkiye, Çin ve İran’da yükselen demokratik devrim dalgasıyla başlamıştı. Bu dört ülkenin 21. yüzyılın başlarında yine emperyalist hegemonyaya karşı mücadelenin ön saflarında yer almaları, kuşkusuz bir rastlantı değildir. Bu durum, çağımızın Milli Demokratik Devrimler ve Sosyalizme Açılım Çağı olduğunun açık bir göstergesidir."
  },
  "keywords": {"en": ["China", "Developing World", "Economy", "Revolution", "Turkey"], "tr": ["Çin", "devrim", "ekonomi", "gelişen dünya", "Türkiye"]},
  "dates": {"received": "2022-02-12", "revised": null, "accepted": "2022-02-25", "published": "2022-03-01"},
  "journal": {"title": "BRIQ Belt & Road Initiative Quarterly", "titleTr": "BRIQ Kuşak ve Yol Girişimi Dergisi", "issn": "2687-5896", "eissn": "2718-0581", "volume": 3, "issue": 2, "year": 2022, "season": {"en": "Spring", "tr": "Bahar"}},
  "pages": {"first": "6", "last": "15"},
  "doi": null,
  "language": ["en", "tr"],
  "license": {"name": "CC BY 4.0", "url": "https://creativecommons.org/licenses/by/4.0/"},
  "funding": null,
  "conflictOfInterest": null,
  "authorContributions": null,
  "ethicsApproval": null,
  "dataAvailability": null,
  "aiUse": null,
  "acknowledgements": null,
  "citation": {"en": "Koray, S. (2022). National-democratic state and development. Belt & Road Initiative Quarterly, 3(2), 6-15.", "tr": "Koray, S. (2022). Milli demokratik devlet ve kalkınma. Kuşak ve Yol Girişimi Dergisi, 3(2), 6-15."},
  "urls": {"en": "https://briqjournal.com/en/national-democratic-state-and-development", "tr": "https://briqjournal.com/milli-demokratik-devlet-ve-kalkinma", "pdfEn": "https://briqjournal.com/sites/default/files/yazi-ici-dosyalar/2022-03/National-Democratic%20State%20and%20Development%20-%20Semih%20Koray.pdf", "pdfTr": "https://briqjournal.com/sites/default/files/yazi-ici-dosyalar/2022-03/Milli%20Demokratik%20Devlet%20ve%20Kalk%C4%B1nma%20-%20Semih%20Koray.pdf", "pdfEnLocal": "/assets/archive/pdfs/articles/milli-demokratik-devlet-ve-kalkinma-en.pdf", "pdfTrLocal": "/assets/archive/pdfs/articles/milli-demokratik-devlet-ve-kalkinma-tr.pdf", "sharedBilingualPdf": false}
}
