{
  "schemaVersion": 2,
  "id": "gaz-hidratlar-yakin-gelecegin-enerji-kaynagi",
  "articleType": {
    "id": "research-article",
    "tr": "Araştırma Makalesi",
    "en": "Research Article",
    "peerReviewed": true
  },
  "title": {
    "en": "Gas Hydrates: The Energy Source of the Near Future",
    "tr": "Gaz Hidratlar: Yakın Geleceğin Enerji Kaynağı"
  },
  "authors": [
    {
      "displayName": "Prof. Dr. Günay Çifci",
      "givenName": "Günay",
      "familyName": "Çifci",
      "orcid": "0000-0002-4380-8056",
      "affiliations": [
        {
          "name": "Department of Geophysics, Dokuz Eylül University",
          "nameTr": "Jeofizik Bölümü, Dokuz Eylül Üniversitesi",
          "nameEn": "Department of Geophysics, Dokuz Eylül University",
          "country": "Turkey",
          "ror": null
        }
      ]
    }
  ],
  "abstract": {
    "en": "Gas Hydrates (Methane Hydrates) are ice-like crystalline solids formed by the trapped of gas molecules in a lattice by water molecules. They are formed under high pressure and low-temperature condition. They usually contain methane gas, which is the main component of natural gas. Water molecules surround the methane molecules trapping them in a ‘cage’ of water molecules to form gas hydrates (GH). They are commonly found in the continental margin (continental slope), seafloor sediments, and near-polar frost (permafrost) areas. Today, marine GH deposits, which can be defined as a type of shale gas on the seabed in economic terms, are seen as a “relatively clean energy source of the near future” and will be an important energy resource as part of the world’s unconventional hydrocarbon revolution. Looking at Turkey, GH occurs at high-pressure and moderate temperatures in the Marmara, Mediterranean, and Black Sea. To carry out work in this area, the Geophysical seismic laboratory established within Dokuz Eylul University with the support of the State Planning Organization (DPT) served as a focal point in many research activities and conducted exploration studies between 2005 and 2018 by mapping GH and taking samples from the seafloor for the first time. Among these studies, the first phase of the National Gashydrate project has been completed and a priceless discovery with a national team has generated decades of energy potential.",
    "tr": "Gaz Hidratlar (Metan Hidratlar); gaz moleküllerinin su molekülleri tarafından bir kafes içerisine hapsedilmesiyle oluşan ve buza benzeyen kristalin katılardır. Yüksek basınç ve düşük sıcaklık koşulları altında oluşurlar ve genellikle doğalgazın ana bileşeni olan metan gazı içerirler. Su molekülleri, metan moleküllerini çevreler ve metan molekülleri bu kafes içerisine hapsolarak gaz hidratları (GH) meydana getirir. Doğada yaygın olarak, kıta kenarı (kıta yamacı), deniz tabanı tortulları (sediment) ve kutba yakın don-ayazı (permafrost) alanlarda saptanmışlardır. Günümüzde ekonomik anlamda, kaya gazının deniz tabanındaki bir türü olarak tanımlanabilecek denizel GH birikimleri tüm dünyada “yakın geleceğin nispeten temiz enerji kaynağı” olarak görülmekte ve dünyanın geleneksel olmayan hidrokarbon devriminde enerji kaynaklarından birisi olacaktır. Ülkemize bakıldığında ise GH’nin Marmara’da, Akdeniz’de ve Karadeniz’de yüksek basınç ve orta sıcaklıklarda meydana geldiği görülmektedir. Bu alandaki çalışmaları yürütmek amacıyla, Devlet Planlama Teşkilatı (DPT) desteği ile Dokuz Eylül Üniversitesi bünyesinde kurulmuş bulunan Jeofizik Sismik Laboratuvar 2005-2018 yılları arasında, GH’nin haritalanması ve deniz tabanından ilk defa örnekler alınmasıyla yapılan keşif çalışmaları ve pek çok araştırma etkinliklerinde bir odak nokta, bir merkez olma işlevi görmüştür. Bu çalışmalar arasında, Milli Gazhidrat projesinin ilk evresi başarıyla tamamlanmış olup, tamamen milli bir ekiple ve paha biçilmez bir keşifle, on yıllarca yetecek potansiyel ve bunun kadar önemli bilgi birikimi (know-how) oluşmuştur."
  },
  "keywords": {
    "en": [
      "Black Sea",
      "unconventional energy source",
      "gas hydrates",
      "geophysics",
      "Mediterranean Sea"
    ],
    "tr": [
      "Akdeniz",
      "gaz hidratlar",
      "geleneksel olmayan enerji kaynağı",
      "jeofizik",
      "Karadeniz"
    ]
  },
  "dates": {
    "received": null,
    "revised": null,
    "accepted": null,
    "published": null
  },
  "journal": {
    "title": "BRIQ Belt & Road Initiative Quarterly",
    "titleTr": "BRIQ Kuşak ve Yol Girişimi Dergisi",
    "issn": "2687-5896",
    "eissn": "2718-0581",
    "volume": 2,
    "issue": 1,
    "year": "2020-2021",
    "season": {
      "en": "Winter",
      "tr": "Kış"
    }
  },
  "pages": {
    "first": "61",
    "last": "75"
  },
  "doi": null,
  "language": [
    "en",
    "tr"
  ],
  "license": {
    "name": "CC BY 4.0",
    "url": "https://creativecommons.org/licenses/by/4.0/"
  },
  "funding": null,
  "conflictOfInterest": null,
  "authorContributions": null,
  "ethicsApproval": null,
  "dataAvailability": null,
  "aiUse": null,
  "acknowledgements": null,
  "citation": {
    "en": "Çifci, G. (2020/2021). Gas hydrates: The energy source of the near future. Belt & Road Initiative Quarterly, 2 (1), 63-76.",
    "tr": "Çifci, G. (2020/2021). Gaz hidratlar: Yakın geleceğin enerji kaynağı. Kuşak ve Yol Girişimi Dergisi, 2 (1), 61-75."
  },
  "urls": {
    "en": "https://briqjournal.com/en/gas-hydrates-the-energy-source-the-near-future",
    "tr": "https://briqjournal.com/gaz-hidratlar-yakin-gelecegin-enerji-kaynagi",
    "pdfEn": "https://briqjournal.com/sites/default/files/dergi-sayilari/2025-12/BRIQ%20Vol.2%20Issue1_Site.pdf",
    "pdfTr": "https://briqjournal.com/sites/default/files/dergi-sayilari/2025-12/BRIQ%202.%20Cilt%201.%20Say%C4%B1_Site.pdf",
    "pdfEnLocal": "/assets/archive/pdfs/articles/gaz-hidratlar-yakin-gelecegin-enerji-kaynagi-en.pdf",
    "pdfTrLocal": "/assets/archive/pdfs/articles/gaz-hidratlar-yakin-gelecegin-enerji-kaynagi-tr.pdf",
    "sharedBilingualPdf": false
  }
}
