{
  "schemaVersion": 2,
  "id": "yunan-basbakani-venizelos-ile-tarihten-bir-soylesi",
  "articleType": {
    "id": "perspective-piece",
    "tr": "Görüş Makalesi",
    "en": "Perspective Piece",
    "peerReviewed": false
  },
  "title": {
    "en": "A Historical Interview With Greek Prime Minister Venizelos",
    "tr": "Yunan Başbakanı Venizelos ile Tarihten Bir Söyleşi"
  },
  "authors": [
    {
      "displayName": "Dr. Ali Şahin",
      "givenName": "Ali",
      "familyName": "Şahin",
      "orcid": "0000-0002-4701-9695",
      "affiliations": [
        {
          "name": "Institute of Atatürk's Principles and Revolution History, Istanbul University",
          "nameTr": "İstanbul Üniversitesi, Atatürk İlkeleri ve İnkılap Tarihi Enstitüsü",
          "nameEn": "Institute of Atatürk's Principles and Revolution History, Istanbul University",
          "country": "Turkey",
          "ror": null
        }
      ]
    }
  ],
  "abstract": {
    "en": "The Times (London, England), Friday, Jul 08, 1921; page.10; Issue 42767.   \n PEACE SIGN IN NEAR EAST \n OVERTURE FROM ANGORA \n A MEETING WITH GENERAL HARRINGTON",
    "tr": "The Times (Londra, İngiltere) 8 Temmuz 1921 Cuma, sayfa:10, Sayı: 42767.  \n YAKIN DOĞU’DA BARIŞ İŞARETİ \n ANKARA’DAN TEKLİF \n GENERAL HARRINGTON İLE BİR GÖRÜŞME *"
  },
  "keywords": {
    "en": [],
    "tr": []
  },
  "dates": {
    "received": null,
    "revised": null,
    "accepted": null,
    "published": null
  },
  "journal": {
    "title": "BRIQ Belt & Road Initiative Quarterly",
    "titleTr": "BRIQ Kuşak ve Yol Girişimi Dergisi",
    "issn": "2687-5896",
    "eissn": "2718-0581",
    "volume": 2,
    "issue": 2,
    "year": 2021,
    "season": {
      "en": "Spring",
      "tr": "Bahar"
    }
  },
  "pages": {
    "first": "85",
    "last": "92"
  },
  "doi": null,
  "language": [
    "en",
    "tr"
  ],
  "license": {
    "name": "CC BY 4.0",
    "url": "https://creativecommons.org/licenses/by/4.0/"
  },
  "funding": null,
  "conflictOfInterest": null,
  "authorContributions": null,
  "ethicsApproval": null,
  "dataAvailability": null,
  "aiUse": null,
  "acknowledgements": null,
  "citation": {
    "en": "Şahin, A. (2021). A historical interview with Greek Prime Minister Venizelos. Belt & Road Initiative Quarterly, 2 (2), 86-92.",
    "tr": "Şahin, A. (2021). Yunan Başbakanı Venizelos ile tarihten bir söyleşi. Kuşak ve Yol Girişimi Dergisi, 2 (2), 85-92."
  },
  "urls": {
    "en": "https://briqjournal.com/en/historical-interview-greek-prime-minister-venizelos",
    "tr": "https://briqjournal.com/yunan-basbakani-venizelos-ile-tarihten-bir-soylesi",
    "pdfEn": "https://briqjournal.com/sites/default/files/yazi-ici-dosyalar/2021-03/A%20Historical%20Interview%20With%20Greek%20Prime%20Minister%20Venizelos.pdf",
    "pdfTr": "https://briqjournal.com/sites/default/files/yazi-ici-dosyalar/2021-03/Yunan%20Ba%C5%9Fbakan%C4%B1%20Venizelos%20ile%20Tarihten%20Bir%20S%C3%B6yle%C5%9Fi.pdf",
    "pdfEnLocal": "/assets/archive/pdfs/articles/yunan-basbakani-venizelos-ile-tarihten-bir-soylesi-en.pdf",
    "pdfTrLocal": "/assets/archive/pdfs/articles/yunan-basbakani-venizelos-ile-tarihten-bir-soylesi-tr.pdf",
    "sharedBilingualPdf": false
  }
}
