{
  "schemaVersion": 2,
  "id": "ogrenmeye-ovgu",
  "articleType": {"id": "poem", "tr": "Şiir", "en": "Poem", "peerReviewed": false},
  "title": {"en": "In Praise of Learning", "tr": "Öğrenmeye Övgü"},
  "authors": [{"displayName": "Bertolt Brecht", "givenName": "Bertolt", "familyName": "Brecht", "orcid": null, "affiliations": []}],
  "abstract": {"en": null, "tr": null},
  "keywords": {"en": [], "tr": []},
  "dates": {"received": null, "revised": null, "accepted": null, "published": "2024-12-01"},
  "journal": {"title": "BRIQ Belt & Road Initiative Quarterly", "titleTr": "BRIQ Kuşak ve Yol Girişimi Dergisi", "issn": "2687-5896", "eissn": "2718-0581", "volume": 6, "issue": 1, "year": "2024-2025", "season": {"en": "Winter", "tr": "Kış"}},
  "pages": {"first": "136", "last": "137"},
  "doi": null,
  "language": ["en", "tr"],
  "license": {"name": "CC BY 4.0", "url": "https://creativecommons.org/licenses/by/4.0/"},
  "funding": null,
  "conflictOfInterest": null,
  "authorContributions": null,
  "ethicsApproval": null,
  "dataAvailability": null,
  "aiUse": null,
  "acknowledgements": null,
  "citation": {"en": "Brecht, B. (2024). In Praise of Learning. BRIQ Belt & Road Initiative Quarterly, 6(1), 136-137.", "tr": "Brecht, B. (2024). Öğrenmeye Övgü. BRIQ Kuşak ve Yol Girişimi Dergisi, 6(1), 136-137."},
  "urls": {"en": "https://briqjournal.com/en/praise-learning", "tr": "https://briqjournal.com/ogrenmeye-ovgu", "pdfEn": "https://briqjournal.com/sites/default/files/yazi-ici-dosyalar/2025-12/BERTOLT%20BRECHT_POEM_ENG.pdf", "pdfTr": "https://briqjournal.com/sites/default/files/yazi-ici-dosyalar/2024-12/136-BERTOLT%20BRECHT--tr.pdf", "pdfEnLocal": "/assets/archive/pdfs/articles/ogrenmeye-ovgu-en.pdf", "pdfTrLocal": "/assets/archive/pdfs/articles/ogrenmeye-ovgu-tr.pdf", "sharedBilingualPdf": false}
}
