{
  "schemaVersion": 2,
  "id": "bell-the-cat",
  "articleType": {"id": "photograph", "tr": "Fotoğraf", "en": "Photograph", "peerReviewed": false},
  "title": {"en": "To Bell the Cat", "tr": "To Bell the Cat"},
  "authors": [
    {"displayName": "Dmitriy Bulin", "givenName": "Dmitriy", "familyName": "Bulin", "orcid": null, "affiliations": []}
  ],
  "abstract": {"en": null, "tr": null},
  "keywords": {"en": [], "tr": []},
  "dates": {"received": null, "revised": null, "accepted": null, "published": "2023-06-01"},
  "journal": {"title": "BRIQ Belt & Road Initiative Quarterly", "titleTr": "BRIQ Kuşak ve Yol Girişimi Dergisi", "issn": "2687-5896", "eissn": "2718-0581", "volume": 4, "issue": 3, "year": 2023, "season": {"en": "Summer", "tr": "Yaz"}},
  "pages": {"first": "93", "last": "93"},
  "doi": null,
  "language": ["en", "tr"],
  "license": {"name": "CC BY 4.0", "url": "https://creativecommons.org/licenses/by/4.0/"},
  "funding": null,
  "conflictOfInterest": null,
  "authorContributions": null,
  "ethicsApproval": null,
  "dataAvailability": null,
  "aiUse": null,
  "acknowledgements": null,
  "citation": {"en": "[Photograph by Dmitry Bulin]. (2023). To bell the cat. BRIQ Belt & Road Initiative Quarterly, 4(3), 93.", "tr": "[Dmitriy Bulin fotoğrafı]. (2023). To bell the cat. BRIQ Kuşak ve Yol Girişimi Dergisi, 4(3), 93."},
  "urls": {"en": "https://briqjournal.com/en/bell-the-cat", "tr": "https://briqjournal.com/bell-the-cat", "pdfEn": "https://briqjournal.com/sites/default/files/yazi-ici-dosyalar/2023-06/C4S3_DMITRIY%20BULIN_ENG.pdf", "pdfTr": "https://briqjournal.com/sites/default/files/yazi-ici-dosyalar/2023-06/C4S3_DMITRIY%20BULIN_TR.pdf", "pdfEnLocal": "/assets/archive/pdfs/articles/bell-the-cat-en.pdf", "pdfTrLocal": "/assets/archive/pdfs/articles/bell-the-cat-tr.pdf", "sharedBilingualPdf": false}
}
