{
  "schemaVersion": 2,
  "id": "cinde-marksizmin-yenilenmesi",
  "articleType": {"id": "book-review", "tr": "Kitap İncelemesi", "en": "Book Review", "peerReviewed": false},
  "title": {"en": "The innovation of Marxism in China", "tr": "Çin’de Marksizm’in Yenilenmesi"},
  "authors": [{"displayName": "Werner Rügemer", "givenName": "Werner", "familyName": "Rügemer", "orcid": "https://orcid.org/0000-0001-2848-0017", "affiliations": []}],
  "abstract": {"en": null, "tr": null},
  "keywords": {"en": [], "tr": []},
  "dates": {"received": "2024-03-17", "revised": null, "accepted": "2024-04-26", "published": "2024-06-01"},
  "journal": {"title": "BRIQ Belt & Road Initiative Quarterly", "titleTr": "BRIQ Kuşak ve Yol Girişimi Dergisi", "issn": "2687-5896", "eissn": "2718-0581", "volume": 5, "issue": 3, "year": 2024, "season": {"en": "Summer", "tr": "Yaz"}},
  "pages": {"first": "344", "last": "348"},
  "doi": null,
  "language": ["en", "tr"],
  "license": {"name": "CC BY 4.0", "url": "https://creativecommons.org/licenses/by/4.0/"},
  "funding": null,
  "conflictOfInterest": null,
  "authorContributions": null,
  "ethicsApproval": null,
  "dataAvailability": null,
  "aiUse": null,
  "acknowledgements": null,
  "citation": {"en": "Rügemer, W. (2024). The innovation of Marxism in China. [Book Review Innovative Marxist School in China Comments by International Scholars on Cheng Enfu’s Academic Thoughts, Foster, J. B., Zyuganov, G., Andréani, T. Onishi, H., Freeman, A., Hoan, N.M. (ed)]. BRIQ Belt and Road Initiative Quarterly, 5(3), 344-348.", "tr": "Rügemer, W. (2024). Çin’de Marksizm’in Yenilenmesi. [Kitap İncelemesi Çin’de Yenilikçi Marksist Okul, Uluslararası Akademisyenlerin Cheng Enfu’nun Akademik Düşünceleri Üzerine Yorumları, Foster, J. B., Zyuganov, G., Andréani, T., Onishi, H., Freeman, A., Hoan, N. M. (ed)]. BRIQ Kuşak ve Yol Girişimi Dergisi, 5(3), 344-348."},
  "urls": {"en": "https://briqjournal.com/en/the-innovation-marxism-china", "tr": "https://briqjournal.com/cinde-marksizmin-yenilenmesi", "pdfEn": "https://briqjournal.com/sites/default/files/yazi-ici-dosyalar/2024-06/344-348%20-%20Werner%20R%C3%BCgemer%20-%20Book%20Review.pdf", "pdfTr": "https://briqjournal.com/sites/default/files/yazi-ici-dosyalar/2024-06/344-348%20-%20Werner%20R%C3%BCgemer%20-%20Kitap%20%C4%B0nceleme.pdf", "pdfEnLocal": "/assets/archive/pdfs/articles/cinde-marksizmin-yenilenmesi-en.pdf", "pdfTrLocal": "/assets/archive/pdfs/articles/cinde-marksizmin-yenilenmesi-tr.pdf", "sharedBilingualPdf": false}
}
