{
  "schemaVersion": 2,
  "id": "rusyanin-bolgesel-guvenlikteki-rolu-uzerine-bir-inceleme-kolektif-guvenlik-antlasmasi-orgutu-ve",
  "articleType": {"id": "research-article", "tr": "Araştırma Makalesi", "en": "Research Article", "peerReviewed": true},
  "title": {
    "en": "The Collective Security Treaty Organization and Counterterrorism in Central Asia: Assessing Russia’s Role in Regional Security",
    "tr": "Rusya’nın Bölgesel Güvenlikteki Rolü Üzerine Bir İnceleme: Kolektif Güvenlik Antlaşması Örgütü ve Orta Asya’da Teröre Karşı Mücadele"
  },
  "authors": [
    {
      "displayName": "Kolosovskiy Yan",
      "givenName": "Yan",
      "familyName": "Kolosovskiy",
      "orcid": "https://orcid.org/0009-0002-4054-1103",
      "affiliations": [
        {"name": "Shandong University", "nameTr": "Shandong Üniversitesi", "nameEn": "Shandong University", "country": "China", "ror": null}
      ]
    }
  ],
  "abstract": {
    "en": "This study examines the efficacy of the CSTO in countering terrorism within Central Asia, with particular focus on Russia’s institutional leadership. Grounded in RSC theory, the analysis investigates the organization’s capacity to adapt to evolving security challenges, including the proliferation of transnational jihadist networks, emerging digital radicalization trends, and security issues persisting in Afghanistan and new challenges from Syria. Through qualitative case analysis and process-tracing methodologies, the research evaluates primary operational data and secondary sources to assess the CSTO’s institutional responses. The findings demonstrate that the CSTO maintains robust conventional response capabilities through its Russian-dominated security framework, and systemic vulnerabilities persist in addressing contemporary hybrid threats. These include deficiencies in cyber counterterrorism measures, inconsistent intelligence coordination among member states, and weak deradicalization strategies. The study further reveals how shifting regional security dynamics, influenced by both internal developments and external threats, challenge the organization’s traditional operational paradigms. Based on these findings, the research proposes policy recommendations.",
    "tr": "Rusya’nın kurumsal liderliğine odaklanan bu çalışma, Orta Asya’da terörizmle mücadelede Kolektif Güvenlik Antlaşması Örgütü’nün (KGAÖ) etkinliğini araştırmaktadır. RSC teorisine dayanan bu inceleme, örgütün ulusötesi terörist ağların büyümesi, dijital radikalleşmedeki yeni eğilimler, Afganistan’da hala var olan güvenlik sorunları ve Suriye’den gelen yeni tehditler gibi değişen güvenlik tehditlerine uyum sağlama yeteneğini incelemektedir. Çalışma, nitel vaka analizi ve süreç izleme yaklaşımlarını kullanarak birincil operasyonel verileri ve ikincil kaynakları analiz etmek suretiyle KGAÖ’nün kurumsal tepkilerini değerlendirmektedir. Sonuçlar, modern hibrit tehditlerle mücadelede sistemik kusurların var olmaya devam ettiğini ve KGAÖ’nün Rusya’nın hakim olduğu güvenlik mimarisi sayesinde güçlü konvansiyonel müdahale kabiliyetlerini koruduğunu göstermektedir. Bunlar arasında yetersiz deradikalizasyon taktikleri, üye devletler arasında eşit olmayan istihbarat işbirliği ve siber teröre karşı mücadele çabalarındaki eksiklikler yer alıyor. Çalışma ayrıca örgütün konvansiyonel operasyon paradigmalarının hem iç hem de dış tehditlerden etkilenen değişen bölgesel güvenlik dinamikleri tarafından nasıl test edildiğini göstermektedir. Çalışma, bu bulgulara dayanarak politika önerilerinde bulunmaktadır."
  },
  "keywords": {
    "en": ["Central Asian security", "counterterrorism strategies", "CSTO", "Islamic radicalism", "Russia’s foreign policy"],
    "tr": ["İslamcı aşırıcılık", "KGAO ve teröre karşı mücadele taktikleri", "Orta Asya güvenliği", "Rusya’nın dış politikası", "ulusötesi cihatçı ağlar"]
  },
  "dates": {"received": "2025-03-26", "revised": "2025-05-03", "accepted": "2025-05-10", "published": "2025-09-01"},
  "journal": {"title": "BRIQ Belt & Road Initiative Quarterly", "titleTr": "BRIQ Kuşak ve Yol Girişimi Dergisi", "issn": "2687-5896", "eissn": "2718-0581", "volume": 6, "issue": 4, "year": 2025, "season": {"en": "Autumn", "tr": "Güz"}},
  "pages": {"first": "383", "last": "408"},
  "doi": null,
  "language": ["en", "tr"],
  "license": {"name": "CC BY 4.0", "url": "https://creativecommons.org/licenses/by/4.0/"},
  "funding": null,
  "conflictOfInterest": null,
  "authorContributions": null,
  "ethicsApproval": null,
  "dataAvailability": null,
  "aiUse": null,
  "acknowledgements": null,
  "citation": {
    "en": "Kolosovskiy, Y. (2025). The Collective Security Treaty Organization and Counterterrorism in Central Asia: Assessing Russia’s Role in Regional Security. BRIQ Belt & Road Initiative Quarterly, 6(4), 383-408.",
    "tr": "Kolosovskiy, Y. (2025). Rusya’nın Bölgesel Güvenlikteki Rolü Üzerine Bir İnceleme: Kolektif Güvenlik Antlaşması Örgütü ve Orta Asya’da Teröre Karşı Mücadele. BRIQ Kuşak ve Yol Girişimi Dergisi, 6(4), 383-408."
  },
  "urls": {
    "en": "https://briqjournal.com/en/the-collective-security-treaty-organization-and-counterterrorism-central-asia-assessing-russias",
    "tr": "https://briqjournal.com/rusyanin-bolgesel-guvenlikteki-rolu-uzerine-bir-inceleme-kolektif-guvenlik-antlasmasi-orgutu-ve",
    "pdfEn": "https://briqjournal.com/sites/default/files/yazi-ici-dosyalar/2025-09/KOLOSOVSKIY%20YAN%20ENG.pdf",
    "pdfTr": "https://briqjournal.com/sites/default/files/yazi-ici-dosyalar/2025-09/KOLOSOVSKIY%20YAN%20TR_0.pdf",
    "pdfEnLocal": "/assets/archive/pdfs/articles/rusyanin-bolgesel-guvenlikteki-rolu-uzerine-bir-inceleme-kolektif-guvenlik-antlasmasi-orgutu-ve-en.pdf",
    "pdfTrLocal": "/assets/archive/pdfs/articles/rusyanin-bolgesel-guvenlikteki-rolu-uzerine-bir-inceleme-kolektif-guvenlik-antlasmasi-orgutu-ve-tr.pdf",
    "sharedBilingualPdf": false
  }
}
