{
  "schemaVersion": 2,
  "id": "cine-ozgu-sosyalist-politik-ekonomiye-genel-bakis",
  "articleType": {"id": "translation", "tr": "Çeviri", "en": "Translation", "peerReviewed": false},
  "title": {"en": "An Overview of Socialist Political Economy with Chinese Characteristics", "tr": "Çin’e Özgü Sosyalist Politik Ekonomi’ye Genel Bakış"},
  "authors": [
    {
      "displayName": "Xinhua Jian",
      "givenName": "Xinhua",
      "familyName": "Jian",
      "orcid": "https://orcid.org/0009-0000-3432-9363",
      "affiliations": [
        {"name": "School of Economics and Management, Wuhan University", "nameTr": "Wuhan Üniversitesi, Ekonomi ve İşletme Fakültesi", "nameEn": "School of Economics and Management, Wuhan University", "country": "China", "ror": null}
      ]
    }
  ],
  "abstract": {
    "en": "This article examines socialist political economy with Chinese characteristics as a coherent theoretical system grounded in Marxist political economy and continuously reshaped through China’s historical practice. The study conceptualizes China's economic model as a dialectical development of Marxist theory under specific national and global conditions. It analyzes the core categories, methodological principles, and value orientations of this framework, with particular attention to the theoretical significance of the socialist market economy as an innovative synthesis of market mechanisms and socialist relations of production. The article further discusses how concepts such as people-centered development, common prosperity, and high-quality growth extend traditional political economy beyond industrial-era assumptions. By emphasizing theory–practice interaction and historical materialism, the study argues that socialist political economy with Chinese characteristics constitutes a distinct paradigm that enriches contemporary political economy and expands the explanatory scope of Marxist economic theory.",
    "tr": "Bu makale, Çin’e özgü sosyalist politik ekonomiyi, Marksist politik ekonomiye dayanan ve Çin’in tarihsel pratiği boyunca sürekli olarak yeniden şekillenen tutarlı bir teorik sistem olarak incelemektedir. Çalışma, Çin’in ekonomik modelini belirli ulusal ve küresel koşullar altında Marksist teorinin diyalektik bir gelişimi olarak kavramsallaştırmaktadır. Bu çerçevenin temel kategorilerini, metodolojik ilkelerini ve değer yönelimlerini analiz ederken, piyasa mekanizmaları ile sosyalist üretim ilişkilerinin yenilikçi bir sentezi olarak sosyalist piyasa ekonomisinin teorik önemine özellikle dikkat çekmektedir. Makale ayrıca, insan merkezli kalkınma, ortak refah ve yüksek kaliteli büyüme gibi kavramların, geleneksel politik ekonomiyi endüstriyel çağın varsayımlarının ötesine nasıl genişlettiğini tartışmaktadır. Teori-uygulama etkileşimini ve tarihsel materyalizmi vurgulayarak, çalışma Çin özellikli sosyalist politik ekonominin, çağdaş politik ekonomiyi zenginleştiren ve Marksist ekonomi teorisinin açıklayıcı kapsamını genişleten ayrı bir paradigma oluşturduğunu savunmaktadır."
  },
  "keywords": {
    "en": ["economic reform in China", "Marxist political economy", "socialist political economy with Chinese characteristics", "socialist construction", "socialist market economy"],
    "tr": ["Çin’e özgü sosyalist politik ekonomi", "Çin’de ekonomik reform", "Marksist politik ekonomi", "sosyalizmin inşası", "sosyalist piyasa ekonomisi"]
  },
  "dates": {"received": "2026-01-27", "revised": null, "accepted": "2026-02-08", "published": "2026-03-01"},
  "journal": {"title": "BRIQ Belt & Road Initiative Quarterly", "titleTr": "BRIQ Kuşak ve Yol Girişimi Dergisi", "issn": "2687-5896", "eissn": "2718-0581", "volume": 7, "issue": 2, "year": 2026, "season": {"en": "Spring", "tr": "Bahar"}},
  "pages": {"first": "143", "last": "166"},
  "doi": null,
  "language": ["en", "tr"],
  "license": {"name": "CC BY 4.0", "url": "https://creativecommons.org/licenses/by/4.0/"},
  "funding": null,
  "conflictOfInterest": null,
  "authorContributions": null,
  "ethicsApproval": null,
  "dataAvailability": null,
  "aiUse": null,
  "acknowledgements": null,
  "citation": {
    "en": "Xinhua, J. (2026). An Overview of Socialist Political Economy with Chinese Characteristics. BRIQ Belt & Road Initiative Quarterly, 7(2), 143-166.",
    "tr": "Xinhua, J. (2026). Çin’e Özgü Sosyalist Politik Ekonomi’ye Genel Bakış. BRIQ Kuşak ve Yol Girişimi Dergisi, 7(2), 143-166."
  },
  "urls": {
    "en": "https://briqjournal.com/en/overview-socialist-political-economy-chinese-characteristics",
    "tr": "https://briqjournal.com/cine-ozgu-sosyalist-politik-ekonomiye-genel-bakis",
    "pdfEn": "https://briqjournal.com/sites/default/files/yazi-ici-dosyalar/2026-02/Xinhua%20Jian_EN.pdf",
    "pdfTr": "https://briqjournal.com/sites/default/files/yazi-ici-dosyalar/2026-02/Xinhua%20Jian_TR.pdf",
    "pdfEnLocal": "/assets/archive/pdfs/articles/cine-ozgu-sosyalist-politik-ekonomiye-genel-bakis-en.pdf",
    "pdfTrLocal": "/assets/archive/pdfs/articles/cine-ozgu-sosyalist-politik-ekonomiye-genel-bakis-tr.pdf",
    "sharedBilingualPdf": false
  }
}
