{
  "schemaVersion": 2,
  "id": "dogu-akdenizde-cin-varligi-suriye-ornegi",
  "articleType": {"id": "review-article", "tr": "Derleme Makalesi", "en": "Review Article", "peerReviewed": true},
  "title": {"en": "Chinese Presence in the Eastern Mediterranean: Evidence from Syria", "tr": "Doğu Akdeniz’de Çin Varlığı: Suriye Örneği"},
  "authors": [
    {"displayName": "Mohamad Zreik", "givenName": "Mohamad", "familyName": "Zreik", "orcid": null, "affiliations": [{"name": "Central China Normal University", "nameTr": "Central China Normal University", "nameEn": "Central China Normal University", "country": "China", "ror": null}]},
    {"displayName": "Zhao Changfeng", "givenName": "Changfeng", "familyName": "Zhao", "orcid": null, "affiliations": [{"name": "Central China Normal University", "nameTr": "Central China Normal University", "nameEn": "Central China Normal University", "country": "China", "ror": null}]}
  ],
  "abstract": {
    "en": "Sino-Syrian relations extend back to 1956, making it one of China’s earliest and most established diplomatic ties with an Arab country. After the Soviet Union turned down Syria’s request for medium-range missile technology in 1980, Beijing declared its willingness to offer Syria the technology. Beijing regards Syria’s intellectual, ideological, cultural and social plurality as a model for the region. Syrian President Bashar al-Assad made his first official trip to China in 2004; economic cooperation between China and Syria was the primary emphasis of this visit. There were contracts for oil and energy tankers and manufacturing facilities in Syria. This article deals with the development of SinoSyrian relations and the main stages in the history of the bilateral relationship. An analytical-descriptive approach is used to explain the strategic relationship between the two countries. The article relies on relevant primary and secondary sources to gain a deeper knowledge and understanding of the topic. The study concludes that China aspires to expand and enhance its presence in the eastern Mediterranean due to its strategic geographical importance, the large economic market and the richness of natural resources that China needs. The article notes that Syria is a strategic area for China, which was evident during the Syrian crisis and China’s use of its veto in the Security Council in favor of the Syrian regime. The article proposes that Sino-Syrian relations are expected to develop in the foreseeable future due to the strategic political understanding between the two regimes and Syria’s active presence on the Belt and Road Initiative, which raises its geographical position in the eastern Mediterranean.",
    "tr": "1956’ya kadar uzanan geçmişiyle Çin-Suriye ilişkileri, Çin’in bir Arap ülkesiyle kurduğu en eski ve en köklü ilişkilerden biridir. 1980 yılında Sovyetler Birliği, Suriye’nin orta menzilli füze teknolojisi talebini geri çevirdikten sonra Pekin, Suriye’ye bu teknolojiyi sunmaya hazır olduğunu açıkladı. Pekin, Suriye’nin entelektüel, ideolojik, kültürel ve sosyal açıdan çeşitlilik içeren yapısını bölge için bir model olarak görüyor. Suriye Devlet Başkanı Beşar Esad, Çin’e ilk resmi ziyaretini 2004 yılında yaptı. Bu ziyaretin ana vurgusu Çin ve Suriye arasındaki ekonomik işbirliğiydi. Bu işbirliği, Suriye’deki petrol ve enerji tankerleri ile üretim tesisleri için yapılan anlaşmaları içeriyordu. Bu makale, ikili ilişkilerin tarihindeki bazı ana aşamalara dayanarak Çin-Suriye ilişkilerinin gelişimini ele almaktadır. İki ülke arasındaki stratejik ilişkiyi açıklamak için betimsel analiz yöntemi kullanılmıştır. Makale, konuyla ilgili daha derin bir bilgiye ve kavrayışa ulaşmak için konuyla ilgili birincil ve ikincil kaynaklara dayandırılmıştır. Çalışma, Doğu Akdeniz’in jeostratejik önemi, geniş ekonomik pazarı ve Çin’in ihtiyaç duyduğu doğal kaynaklar açısından zenginliği nedeniyle Çin’in buradaki varlığını genişletmeyi ve geliştirmeyi hedeflediği sonucuna varmıştır. Makale, Suriye’nin Çin için stratejik bir alan olduğuna işaret etmiştir. Bu gerçek, Suriye krizi sırasında ve Çin’in BM Güvenlik Konseyi’nde veto hakkını Suriye hükümeti lehine kullanmasında açıkça ortaya çıkmıştır. Makale, iki hükümet arasındaki stratejik siyasi uyum ve Doğu Akdeniz’deki coğrafi konumunun önemini artıran bir etken olan Suriye’nin Kuşak ve Yol Girişimi’ndeki aktif varlığı nedeniyle Çin-Suriye ilişkilerinin öngörülebilir gelecekte gelişme yolunda olduğunu öne sürmektedir."
  },
  "keywords": {"en": ["China", "Eastern Mediterranean", "Middle East", "Syria", "Syrian Crisis"], "tr": ["BAKA", "Çin", "Doğu Akdeniz", "Kuşak ve Yol Girişimi", "Suriye krizi"]},
  "dates": {"received": "2022-06-26", "revised": null, "accepted": "2022-08-25", "published": "2022-12-01"},
  "journal": {"title": "BRIQ Belt & Road Initiative Quarterly", "titleTr": "BRIQ Kuşak ve Yol Girişimi Dergisi", "issn": "2687-5896", "eissn": "2718-0581", "volume": 4, "issue": 1, "year": "2022-2023", "season": {"en": "Winter", "tr": "Kış"}},
  "pages": {"first": "72", "last": "89"},
  "doi": null,
  "language": ["en", "tr"],
  "license": {"name": "CC BY 4.0", "url": "https://creativecommons.org/licenses/by/4.0/"},
  "funding": null,
  "conflictOfInterest": null,
  "authorContributions": null,
  "ethicsApproval": null,
  "dataAvailability": null,
  "aiUse": null,
  "acknowledgements": null,
  "citation": {"en": "Zreik, M. & Zhao, C. (2022). Chinese presence in the Eastern Mediterranean: evidence from Syria. BRIQ Belt & Road Initiative Quarterly, 4(1), 72-89.", "tr": "Zreik, M. & Zhao, C. (2022). Doğu Akdeniz’de Çin Varlığı: Suriye Örneği. BRIQ Kuşak ve Yol Girişimi Dergisi, 4(1), 72-89."},
  "urls": {"en": "https://briqjournal.com/en/chinese-presence-the-eastern-mediterranean-evidence-syria", "tr": "https://briqjournal.com/dogu-akdenizde-cin-varligi-suriye-ornegi", "pdfEn": "https://briqjournal.com/sites/default/files/yazi-ici-dosyalar/2022-12/Mohamad%20Zreik_ENG_0.pdf", "pdfTr": "https://briqjournal.com/sites/default/files/yazi-ici-dosyalar/2022-12/Mohamad%20Zreik_TR.pdf", "pdfEnLocal": "/assets/archive/pdfs/articles/dogu-akdenizde-cin-varligi-suriye-ornegi-en.pdf", "pdfTrLocal": "/assets/archive/pdfs/articles/dogu-akdenizde-cin-varligi-suriye-ornegi-tr.pdf", "sharedBilingualPdf": false}
}
