{
  "schemaVersion": 2,
  "id": "turkiyenin-islamofobi-ile-mucadele-cabalari-yanitlar-motivasyonlar-ve-zorluklar",
  "articleType": {"id": "research-article", "tr": "Araştırma Makalesi", "en": "Research Article", "peerReviewed": true},
  "title": {"en": "Türkiye’s Efforts to Combat Islamophobia: Responses, Motivations, and Challenges", "tr": "Türkiye’nin İslamofobi ile Mücadele Çabaları: Yanıtlar, Motivasyonlar ve Zorluklar"},
  "authors": [{"displayName": "Guo Xin’gen", "givenName": "Xin’gen", "familyName": "Guo", "orcid": "https://orcid.org/0009-0006-2318-2224", "affiliations": [{"name": "Shanghai University, Center for Turkish Studies", "nameTr": "Şanghay Üniversitesi, Türkiye Araştırmaları Merkezi", "nameEn": "Shanghai University, Center for Turkish Studies", "country": "China", "ror": null}]}],
  "abstract": {"en": "This paper explores Türkiye’s responses, motivations, and challenges in the process of combating Islamophobia. From the Turkish perspective, Islamophobia has exerted historical and contemporary negative impacts on Türkiye. In response, Türkiye takes steps from two dimensions of reality and perception. At the practical level, Türkiye employs a combination of bilateral diplomacy, multilateral diplomacy, and foreign propaganda. At the spiritual level, Türkiye emphasizes its national image and soft power. As a Muslim country, Türkiye’s efforts to combat Islamophobia highlight the factors of Türkiye’s national interests, the moderate Islamic attributes of the Justice and Development Party, and the historical and cultural traditions of Islam. In the fight against Islamophobia, Türkiye also faces numerous challenges, including the intricacy of Islamophobia, the entrenchment of stereotypes, the obstruction from other Islamic countries, and the rise of right-wing populism in Europe. The Global Civilization Initiative proposed by China may become another potential alternative to addressing Islamophobia.", "tr": "Bu makale, Türkiye’nin İslamofobi ile mücadele sürecindeki yanıtlarını, motivasyonlarını ve karşılaştığı zorlukları araştırmaktadır. Türk perspektifinden bakıldığında, İslamofobi, Türkiye üzerinde tarihsel ve güncel olumsuz etkiler yaratmıştır. Buna yanıt olarak Türkiye, gerçeklik ve algı olmak üzere iki boyutta adımlar atmaktadır. Pratik düzlemde Türkiye, ikili diplomasi, çok taraflı diplomasi ve yabancı propaganda kombinasyonunu kullanmaktadır. Manevi düzeyde ise, Türkiye ulusal imajını ve yumuşak gücünü vurgulamaktadır. Müslüman bir ülke olarak Türkiye’nin İslamofobi ile mücadele çabaları, Türkiye’nin ulusal çıkarlarını, Adalet ve Kalkınma Partisi’nin ılımlı İslami niteliklerini ve İslam’ın tarihi ve kültürel geleneklerini öne çıkarmaktadır. İslamofobi ile mücadelede Türkiye, İslamofobi’nin karmaşıklığı, basmakalıp düşüncelerin yerleşmesi, diğer İslam ülkelerinden gelen engellemeler ve Avrupa’da sağ kanat popülizminin yükselişi gibi birçok zorlukla da karşı karşıya kalmaktadır. Çin tarafından önerilen Küresel Medeniyet Girişimi, İslamofobi ile mücadelede başka bir potansiyel alternatif olabilir."},
  "keywords": {"en": ["civilization", "clash of civilizations", "Global Civilization Initiative", "Islamophobia", "Türkiye"], "tr": ["İslamofobi", "Küresel Medeniyet Girişimi", "medeniyet", "medeniyetler çatışması", "Türkiye"]},
  "dates": {"received": "2024-03-05", "revised": null, "accepted": "2024-04-27", "published": "2024-06-01"},
  "journal": {"title": "BRIQ Belt & Road Initiative Quarterly", "titleTr": "BRIQ Kuşak ve Yol Girişimi Dergisi", "issn": "2687-5896", "eissn": "2718-0581", "volume": 5, "issue": 3, "year": 2024, "season": {"en": "Summer", "tr": "Yaz"}},
  "pages": {"first": "272", "last": "287"},
  "doi": null,
  "language": ["en", "tr"],
  "license": {"name": "CC BY 4.0", "url": "https://creativecommons.org/licenses/by/4.0/"},
  "funding": null,
  "conflictOfInterest": null,
  "authorContributions": null,
  "ethicsApproval": null,
  "dataAvailability": null,
  "aiUse": null,
  "acknowledgements": null,
  "citation": {"en": "Guo, X. (2024). Türkiye’s Efforts to Combat Islamophobia: Responses, Motivations, and Challenges. BRIQ Belt and Road Initiative Quarterly, 5(3), 272-287.", "tr": "Guo, X. (2024). Türkiye’nin İslamofobi ile Mücadele Çabaları: Yanıtlar, Motivasyonlar ve Zorluklar. BRIQ Kuşak ve Yol Girişimi Dergisi, 5(3), 272-287."},
  "urls": {"en": "https://briqjournal.com/en/turkiyes-efforts-combat-islamophobia-responses-motivations-and-challenges", "tr": "https://briqjournal.com/turkiyenin-islamofobi-ile-mucadele-cabalari-yanitlar-motivasyonlar-ve-zorluklar", "pdfEn": "https://briqjournal.com/sites/default/files/yazi-ici-dosyalar/2024-06/272-287%20-%20Guo%20Xin%27gen%20-%20ENG.pdf", "pdfTr": "https://briqjournal.com/sites/default/files/yazi-ici-dosyalar/2024-06/272-287%20-%20Guo%20Xin%27gen%20-%20TR.pdf", "pdfEnLocal": "/assets/archive/pdfs/articles/turkiyenin-islamofobi-ile-mucadele-cabalari-yanitlar-motivasyonlar-ve-zorluklar-en.pdf", "pdfTrLocal": "/assets/archive/pdfs/articles/turkiyenin-islamofobi-ile-mucadele-cabalari-yanitlar-motivasyonlar-ve-zorluklar-tr.pdf", "sharedBilingualPdf": false}
}
